7,23,2,1,3191,2,2,41,1,0,BHAM,HOU,"J.Smith pass short right INTERCEPTED at HOU 38. Intercepted by W.Likely at HOU 38. W.Likely for 62 yards, TOUCHDOWN.",3.27644457784481,-10.2764445778448,NA,3,J.Smith,NA,HOU,BHAM,9,7
7,24,2,1,3177,NA,NA,85,0,0,HOU,HOU,N.Vogel extra point is no good.,0.94,-0.94,NA,NA,N.Vogel,NA,HOU,BHAM,9,7
7,25,2,1,3177,NA,NA,25,0,0,BHAM,HOU,N.Vogel kicks 57 yards from HOU 25 to the BHAM 18. V.Bolden returns the kickoff. Tackled by R.Northrup; R.White at BHAM 40.,1.49537922395393,0.396124316379428,NA,NA,N.Vogel,NA,HOU,BHAM,9,7
7,26,2,1,3171,1,10,60,0,1,BHAM,HOU,"C.Marable rushed right end to HOU 45 for 15 yards. Tackled by M.Abernathy, J.Summers at HOU 45.",1.89150354033336,1.07866607489996,15,NA,C.Marable,NA,HOU,BHAM,9,7
7,27,2,1,3129,1,10,45,1,0,BHAM,HOU,J.Smith pass short right complete to HOU 36. Catch made by O.Mitchell at HOU 36. Gain of 9 yards. Tackled by J.Summers at HOU 36.,2.97016961523332,0.745736839016899,9,9,J.Smith,O.Mitchell,HOU,BHAM,9,7
7,28,2,1,3103,2,1,36,0,1,BHAM,HOU,"C.Marable rushed left guard to HOU 31 for 5 yards. Tackled by A.Gooden, D.Davis at HOU 31.",3.71590645425022,0.287440246785991,5,NA,C.Marable,NA,HOU,BHAM,9,7
7,29,2,1,3067,1,10,31,0,1,BHAM,HOU,"T.Brooks-James rushed right end to HOU 23 for 8 yards. Pushed out of bounds by D.Payne, M.Abernathy at HOU 23.",4.00334670103621,0.576047174516134,8,NA,T.Brooks-James,NA,HOU,BHAM,9,7
7,30,2,1,3029,2,2,23,1,0,BHAM,HOU,"J.Smith pass short left complete to HOU 24. Catch made by V.Bolden at HOU 24. Gain of 5 yards. Tackled by M.Abernathy, D.Payne at HOU 18.",4.57939387555234,0.315500971046276,5,-1,J.Smith,V.Bolden,HOU,BHAM,9,7
7,31,2,1,2993,1,10,18,1,0,BHAM,HOU,"J.Smith pass short middle complete to HOU 22. Catch made by V.Bolden at HOU 22. Gain of 1 yards. Tackled by R.Northrup, D.Payne at HOU 17.",4.89489484659862,-0.456823410000652,1,-4,J.Smith,V.Bolden,HOU,BHAM,9,7
7,32,2,1,2955,2,9,17,1,0,BHAM,HOU,"J.Smith pass short middle complete to HOU 14. Catch made by T.Brooks-James at HOU 14. Gain of 4 yards. Tackled by D.Payne, W.Likely at HOU 13.",4.43807143659797,-0.184252050705254,4,3,J.Smith,T.Brooks-James,HOU,BHAM,9,7
7,33,2,1,2918,3,5,13,1,0,BHAM,HOU,J.Smith steps back to pass. J.Smith pass incomplete deep middle intended for C.Angeline.,4.25381938589271,-1.37524866499007,NA,11,J.Smith,C.Angeline,HOU,BHAM,9,7
7,34,2,1,2913,4,5,13,0,0,BHAM,HOU,"B.Aubrey 32 yard field goal attempt is good, Center-R.Langan, Holder-C.Wadman.",2.87857072090264,0.121429279097356,NA,NA,B.Aubrey,NA,HOU,BHAM,9,10
7,35,2,1,2908,NA,NA,25,0,0,HOU,BHAM,"B.Aubrey kicks 63 yards from BHAM 25 to the HOU 12. I.Zuber returns the kickoff. Tackled by N.Holley, D.Gates at HOU 31.",1.99833883205429,-0.153441698290408,NA,NA,B.Aubrey,NA,HOU,BHAM,9,10
7,36,2,1,2903,1,10,69,1,0,HOU,BHAM,"C.Thorson steps back to pass. C.Thorson pass incomplete short middle intended for B.Barnes (S.Wright, T.Robinson).",1.84489713376388,-0.535565408878028,NA,9,C.Thorson,B.Barnes,HOU,BHAM,9,10
7,37,2,1,2899,2,10,69,0,1,HOU,BHAM,M.Thompson rushed left tackle to HOU 32 for 1 yards. Tackled by A.Adeoye at HOU 32.,1.30933172488585,-0.683902163524181,1,NA,M.Thompson,NA,HOU,BHAM,9,10
7,38,2,1,2859,3,9,68,1,0,HOU,BHAM,"C.Thorson steps back to pass. C.Thorson pass incomplete deep left intended for T.Simmons. PENALTY on BHAM-C.McFarland, Personal Foul / Defense, 15 yards, accepted. No Play.",0.62542956136167,2.2523777729366,NA,33,C.Thorson,T.Simmons,HOU,BHAM,9,10
7,40,2,1,2851,1,10,53,0,0,HOU,BHAM,Timeout The Replay Official reviewed the targeting and the play was upheld.,2.87780733429827,0,NA,NA,Timeout,NA,HOU,BHAM,9,10
7,41,2,1,2851,1,10,53,1,0,HOU,BHAM,C.Thorson steps back to pass. C.Thorson pass incomplete short left intended for J.Allen.,2.87780733429827,-0.505808519665152,NA,3,C.Thorson,J.Allen,HOU,BHAM,9,10
7,42,2,1,2847,2,10,53,1,0,HOU,BHAM,C.Thorson pass short right complete to BHAM 48. Catch made by A.Ratliff-Williams at BHAM 48. Gain of 5 yards. Tackled by T.Robinson at BHAM 48.,2.37199881463312,-0.447516333311796,5,5,C.Thorson,A.Ratliff-Williams,HOU,BHAM,9,10
7,43,2,1,2805,3,5,48,1,0,HOU,BHAM,"C.Thorson pass short middle complete to BHAM 43. Catch made by A.Ratliff-Williams at BHAM 43. Gain of 8 yards. Tackled by D.Gates, J.Tillery at BHAM 40.",1.92448248132132,1.64171176054515,8,5,C.Thorson,A.Ratliff-Williams,HOU,BHAM,9,10
7,44,2,1,2766,1,10,40,1,0,HOU,BHAM,C.Thorson scrambles up the middle to BHAM 31 for 9 yards. Tackled by J.Newsome at BHAM 31.,3.56619424186647,0.719563996768557,9,NA,C.Thorson,NA,HOU,BHAM,9,10
7,45,2,1,2724,2,1,31,0,1,HOU,BHAM,"M.Thompson rushed right guard to BHAM 28 for 3 yards. Tackled by N.Holley, D.Tillman at BHAM 28.",4.28575823863503,0.0835846703266725,3,NA,M.Thompson,NA,HOU,BHAM,9,10
7,46,2,1,2700,1,10,28,0,0,HOU,BHAM,End Quarter 1,4.3693429089617,0,NA,NA,End,NA,HOU,BHAM,9,10
7,47,2,2,2700,1,10,28,0,1,HOU,BHAM,"M.Thompson rushed left end to BHAM 25 for 3 yards. Tackled by D.Tillman, T.Hayes at BHAM 25.",4.3693429089617,-0.269303130218759,3,NA,M.Thompson,NA,HOU,BHAM,9,10
7,48,2,2,2659,2,7,25,1,0,HOU,BHAM,"C.Thorson pass deep middle complete to BHAM End Zone. Catch made by I.Zuber at BHAM End Zone. Gain of 25 yards. I.Zuber for 25 yards, TOUCHDOWN.",4.10003977874294,2.89996022125706,25,25,C.Thorson,I.Zuber,HOU,BHAM,15,10
7,49,2,2,2652,NA,NA,2,1,0,HOU,BHAM,TWO-POINT CONVERSION ATTEMPT. C.Thorson steps back to pass. J.Smith sacked at BHAM 17 for yards (D.Gates) TWO-POINT ATTEMPT FAILS.,0.96,-0.96,NA,NA,TWO-POINT,NA,HOU,BHAM,15,10
7,50,2,2,2652,NA,NA,25,0,0,BHAM,HOU,N.Vogel kicks 75 yards from HOU 25 to the BHAM End Zone. Touchback.,1.51996064931154,-0.442962018307298,NA,NA,N.Vogel,NA,HOU,BHAM,15,10
7,51,2,2,2652,1,10,75,1,0,BHAM,HOU,"J.Smith pass deep middle complete to BHAM 41. Catch made by M.Williams at BHAM 41. Gain of 16 yards. Tackled by M.Abernathy, M.Bunch at BHAM 41.",1.07699863100424,0.912597055081278,16,16,J.Smith,M.Williams,HOU,BHAM,15,10
7,52,2,2,2611,1,10,59,1,0,BHAM,HOU,J.Smith steps back to pass. J.Smith pass incomplete deep right intended for O.Mitchell.,1.98959568608552,-0.514720367500558,NA,18,J.Smith,O.Mitchell,HOU,BHAM,15,10
7,53,2,2,2604,2,10,59,1,0,BHAM,HOU,"J.Smith pass short right complete to BHAM 35. Catch made by V.Bolden at BHAM 35. Gain of 15 yards. Tackled by B.Brown, M.Harris at BHAM 50. PENALTY on BHAM-J.McCray, Illegal Blindside Block, 15 yards, accepted.",1.47487531858496,-0.770630946615711,15,-6,J.Smith,V.Bolden,HOU,BHAM,15,10
7,55,2,2,2568,2,17,66,1,0,BHAM,HOU,"J.Smith steps back to pass. J.Smith sacked at BHAM 27 for -7 yards (C.Odom) J.Smith FUMBLES, forced by C.Odom. Fumble RECOVERED by BHAM-D.Harper at BHAM 27. Tackled by C.Odom at BHAM 27.",0.704244371969253,-1.2305047493428,-7,NA,J.Smith,NA,HOU,BHAM,15,10
7,57,2,2,2523,3,24,73,1,0,BHAM,HOU,J.Smith steps back to pass. J.Smith pass incomplete deep left intended for V.Bolden.,-0.526260377373546,-0.900326543021947,NA,47,J.Smith,V.Bolden,HOU,BHAM,15,10
7,58,2,2,2517,4,24,73,0,0,BHAM,HOU,"C.Wadman punts 55 yards to HOU 18, Center-R.Langan. Fair catch by W.Likely.",-1.42658692039549,0.511959997005761,NA,NA,C.Wadman,NA,HOU,BHAM,15,10
7,59,2,2,2508,1,10,82,0,1,HOU,BHAM,M.Thompson rushed left end to HOU 24 for 6 yards. Tackled by T.Robinson; A.Adeoye at HOU 24.,0.914626923389733,0.118431543931365,6,NA,M.Thompson,NA,HOU,BHAM,15,10
7,60,2,2,2487,2,4,76,0,0,HOU,BHAM,TV Timeout,1.0330584673211,0,NA,NA,TV,NA,HOU,BHAM,15,10
7,61,2,2,2487,2,4,76,1,0,HOU,BHAM,C.Thorson pass short right complete to HOU 30. Catch made by T.Palka at HOU 30. Gain of 6 yards. Pushed out of bounds by J.Tillery at HOU 30.,1.0330584673211,0.685292654670775,6,6,C.Thorson,T.Palka,HOU,BHAM,15,10
7,62,2,2,2458,1,10,70,0,1,HOU,BHAM,"M.Thompson rushed left tackle to HOU 31 for 1 yards. Tackled by W.Yarbary, N.Holley at HOU 31.",1.71835112199187,-0.677739358739927,1,NA,M.Thompson,NA,HOU,BHAM,15,10
7,63,2,2,2413,2,9,69,0,0,HOU,BHAM,Timeout #1 by HOU.,1.04061176325195,0,NA,NA,Timeout,NA,HOU,BHAM,15,10
7,64,2,2,2413,2,9,69,1,0,HOU,BHAM,C.Thorson pass short right INTERCEPTED at HOU 47. Intercepted by L.Burns at HOU 47. Tackled by T.Palka at HOU 36.,1.04061176325195,-4.68945122545119,NA,16,C.Thorson,NA,HOU,BHAM,15,10
7,65,2,2,2404,1,10,36,0,1,BHAM,HOU,T.Brooks-James rushed right guard to HOU 33 for 3 yards. Tackled by C.Odom at HOU 33.,3.64883946219925,-0.177874389570206,3,NA,T.Brooks-James,NA,HOU,BHAM,15,10
7,66,2,2,2367,2,7,33,0,1,BHAM,HOU,"T.Brooks-James rushed left guard to HOU 33 for 0 yards. Tackled by C.Thomas, R.Northrup at HOU 33.",3.47096507262904,-0.651294008945115,0,NA,T.Brooks-James,NA,HOU,BHAM,15,10
7,67,2,2,2327,3,7,33,1,0,BHAM,HOU,J.Smith pass short middle complete to HOU 25. Catch made by C.Angeline at HOU 25. Gain of 8 yards. Tackled by M.Bunch; D.Payne at HOU 25.,2.81967106368393,1.51946791098453,8,8,J.Smith,C.Angeline,HOU,BHAM,15,10
7,68,2,2,2291,1,10,25,0,1,BHAM,HOU,J.Smith rushed right guard to HOU 27 for -2 yards. Tackled by D.Davis at HOU 27.,4.33913897466846,-0.882641056668945,-2,NA,J.Smith,NA,HOU,BHAM,15,10
7,69,2,2,2251,2,12,27,1,0,BHAM,HOU,J.Smith scrambles left end to HOU 17 for 10 yards. Pushed out of bounds by D.Payne at HOU 17.,3.45649791799951,0.943303491512779,10,NA,J.Smith,NA,HOU,BHAM,15,10
7,70,2,2,2212,3,2,17,0,1,BHAM,HOU,C.Marable rushed left end to HOU 19 for -2 yards. Tackled by W.Likely at HOU 19.,4.39980140951229,-1.84849537897389,-2,NA,C.Marable,NA,HOU,BHAM,15,10
7,71,2,2,2167,4,4,19,0,0,BHAM,HOU,"B.Aubrey 37 yard field goal attempt is good, Center-R.Langan, Holder-C.Wadman.",2.5513060305384,0.448693969461601,NA,NA,B.Aubrey,NA,HOU,BHAM,15,13
7,72,2,2,2163,NA,NA,25,0,0,HOU,BHAM,B.Aubrey kicks 65 yards from BHAM 25 to the HOU 10. W.Likely returns the kickoff. Tackled by N.Holley at HOU 31.,1.64545199205168,-0.200814804295078,NA,NA,B.Aubrey,NA,HOU,BHAM,15,13
7,73,2,2,2157,1,10,69,0,1,HOU,BHAM,M.Thompson rushed right tackle to HOU 32 for 1 yards. Tackled by S.Wright at HOU 32.,1.4446371877566,-0.530548766022548,1,NA,M.Thompson,NA,HOU,BHAM,15,13
7,74,2,2,2115,2,9,68,1,0,HOU,BHAM,C.Thorson pass short right complete to HOU 33. Catch made by J.Allen at HOU 33. Gain of 3 yards. Pushed out of bounds by B.Allen at HOU 35.,0.91408842173405,-0.48127151071094,3,1,C.Thorson,J.Allen,HOU,BHAM,15,13
7,75,2,2,2090,3,6,65,1,0,HOU,BHAM,C.Thorson steps back to pass. C.Thorson pass incomplete short right intended for I.Zuber.,0.43281691102311,-1.31447573169135,NA,9,C.Thorson,I.Zuber,HOU,BHAM,15,13
7,76,2,2,2086,4,6,65,0,0,HOU,BHAM,"A.Galitz punts 56 yards to BHAM 9, Center-T.Addington. Downed by M.Abernathy.",-0.881658820668235,0.71847072779201,NA,NA,A.Galitz,NA,HOU,BHAM,15,13
7,77,2,2,2073,1,10,91,1,0,BHAM,HOU,"J.Smith pass short right complete to BHAM 8. Catch made by V.Bolden at BHAM 8. Gain of 2 yards. V.Bolden FUMBLES, forced by W.Likely. Fumble RECOVERED by HOU-J.Summers at BHAM 14. Tackled by V.Bolden at BHAM 10.",0.163188092876226,-5.26219035946997,2,-1,J.Smith,V.Bolden,HOU,BHAM,15,13
7,79,2,2,2066,1,10,10,0,1,HOU,BHAM,K.Bahar rushed left tackle to BHAM 12 for -2 yards. Tackled by D.Gates; D.Tillman at BHAM 12.,5.09900226659374,-0.792165822407696,-2,NA,K.Bahar,NA,HOU,BHAM,15,13
7,80,2,2,2026,2,12,12,1,0,HOU,BHAM,K.Bahar steps back to pass. K.Bahar pass incomplete short left intended for I.Zuber.,4.30683644418605,-0.789124276372604,NA,8,K.Bahar,I.Zuber,HOU,BHAM,15,13
7,81,2,2,2022,3,12,12,1,0,HOU,BHAM,K.Bahar steps back to pass. K.Bahar sacked at BHAM 13 for -1 yards (D.Gates),3.51771216781344,-0.794696992408717,-1,NA,K.Bahar,NA,HOU,BHAM,15,13
7,82,2,2,1983,4,13,13,0,0,HOU,BHAM,"N.Vogel 31 yard field goal attempt is good, Center-T.Addington, Holder-A.Galitz.",2.72301517540473,0.276984824595274,NA,NA,N.Vogel,NA,HOU,BHAM,18,13
7,83,2,2,1978,NA,NA,25,0,0,BHAM,HOU,N.Vogel kicks 70 yards from HOU 25 to the BHAM 5. V.Bolden returns the kickoff. Pushed out of bounds by N.Vogel at BHAM 46.,1.66809446574189,0.563209415297024,NA,NA,N.Vogel,NA,HOU,BHAM,18,13
7,84,2,2,1970,1,10,54,0,1,BHAM,HOU,"C.Marable rushed left guard to HOU 49 for 5 yards. Tackled by W.Likely, B.Brown at HOU 49.",2.23130388103891,0.191197501495481,5,NA,C.Marable,NA,HOU,BHAM,18,13
7,85,2,2,1933,2,5,49,1,0,BHAM,HOU,J.Smith pass short right complete to HOU 42. Catch made by V.Bolden at HOU 42. Gain of 8 yards. Tackled by B.Brown at HOU 41.,2.42250138253439,0.644384505809285,8,7,J.Smith,V.Bolden,HOU,BHAM,18,13
7,86,2,2,1920,1,10,41,0,0,BHAM,HOU,Two minute warning.,3.06688588834368,0,NA,NA,Two,NA,HOU,BHAM,18,13
7,87,2,2,1920,1,10,41,1,0,BHAM,HOU,J.Smith steps back to pass. J.Smith pass incomplete short right intended for V.Bolden.,3.06688588834368,-0.36592521017883,NA,6,J.Smith,V.Bolden,HOU,BHAM,18,13
7,88,2,2,1917,2,10,41,1,0,BHAM,HOU,J.Smith steps back to pass. J.Smith pass incomplete short right intended for O.Mitchell (R.Northrup).,2.70096067816485,-0.610634747194126,NA,6,J.Smith,O.Mitchell,HOU,BHAM,18,13
7,89,2,2,1913,3,10,41,1,0,BHAM,HOU,J.Smith steps back to pass. J.Smith pass incomplete deep right intended for O.Mitchell (J.Summers).,2.09032593097072,-1.57748306088615,NA,29,J.Smith,O.Mitchell,HOU,BHAM,18,13
7,90,2,2,1906,4,10,41,0,0,BHAM,HOU,"C.Wadman punts 13 yards to HOU 28, Center-R.Langan. Downed by B.Allen.",0.512842870084569,-1.7577418924775,NA,NA,C.Wadman,NA,HOU,BHAM,18,13
7,91,2,2,1895,1,10,72,0,1,HOU,BHAM,D.Dawkins rushed right guard to HOU 33 for 5 yards. Tackled by J.Thompson at HOU 33.,1.24489902239293,-0.325079128728248,5,NA,D.Dawkins,NA,HOU,BHAM,18,13
7,92,2,2,1857,2,5,67,0,1,HOU,BHAM,"D.Dawkins rushed up the middle to HOU 40 for 7 yards. Tackled by N.Holley, B.Allen at HOU 40.",0.91981989366468,0.358750340761617,7,NA,D.Dawkins,NA,HOU,BHAM,18,13
7,93,2,2,1842,1,10,60,0,1,HOU,BHAM,"D.Dawkins rushed up the middle to HOU 42 for 2 yards. Tackled by N.Holley, S.Wright at HOU 42.",1.2785702344263,-0.146312836674042,2,NA,D.Dawkins,NA,HOU,BHAM,18,13
7,94,2,2,1838,2,8,58,0,0,HOU,BHAM,Timeout #2 by HOU.,1.13225739775226,0,NA,NA,Timeout,NA,HOU,BHAM,18,13
7,95,2,2,1838,2,8,58,0,1,HOU,BHAM,D.Dawkins rushed up the middle to HOU 46 for 4 yards. Tackled by N.Holley at HOU 46.,1.13225739775226,0.0461684612091631,4,NA,D.Dawkins,NA,HOU,BHAM,18,13
7,96,2,2,1834,3,4,54,0,0,HOU,BHAM,Timeout #1 by BHAM.,1.17842585896142,0,NA,NA,Timeout,NA,HOU,BHAM,18,13
7,97,2,2,1834,3,4,54,0,1,HOU,BHAM,D.Dawkins rushed left tackle to BHAM 48 for 6 yards. Tackled by T.Hayes; D.Gates at BHAM 48.,1.17842585896142,-0.0240695491665974,6,NA,D.Dawkins,NA,HOU,BHAM,18,13
7,98,2,2,1811,1,10,48,1,0,HOU,BHAM,K.Bahar steps back to pass. K.Bahar pass incomplete deep right intended for I.Zuber.,1.15435630979482,-0.446208918467164,NA,15,K.Bahar,I.Zuber,HOU,BHAM,18,13
7,99,2,2,1804,2,10,48,1,0,HOU,BHAM,K.Bahar steps back to pass. K.Bahar pass incomplete deep right intended for I.Zuber (C.McFarland).,0.708147391327657,-0.708147391327657,NA,48,K.Bahar,I.Zuber,HOU,BHAM,18,13
7,100,2,2,1800,NA,NA,NA,0,0,HOU,BHAM,End Quarter 2,0,0,NA,NA,End,NA,HOU,BHAM,18,13
7,101,2,3,1800,NA,NA,25,0,0,BHAM,HOU,N.Vogel kicks 68 yards from HOU 25 to the BHAM 7. V.Bolden returns the kickoff. Tackled by T.Palka; M.Bunch at BHAM 36.,1.31759998621419,0.299069005530328,NA,NA,N.Vogel,NA,HOU,BHAM,18,13
7,102,2,3,1794,1,10,64,0,1,BHAM,HOU,"T.Brooks-James rushed left tackle to HOU 40 for 24 yards. Tackled by A.Victor, D.Payne at HOU 40.",1.61666899174452,1.69792341627181,24,NA,T.Brooks-James,NA,HOU,BHAM,18,13
7,103,2,3,1752,1,10,40,1,0,BHAM,HOU,J.Smith pass short right complete to HOU 41. Catch made by V.Bolden at HOU 41. Gain of 6 yards. Tackled by W.Likely at HOU 34.,3.31459240801632,0.17597146728076,6,-1,J.Smith,V.Bolden,HOU,BHAM,18,13
7,104,2,3,1716,2,4,34,1,0,BHAM,HOU,J.Smith steps back to pass. J.Smith pass incomplete short left intended for V.Bolden.,3.49056387529708,-0.52286855794955,NA,-1,J.Smith,V.Bolden,HOU,BHAM,18,13
7,105,2,3,1713,3,3,34,0,0,BHAM,HOU,Timeout #1 by HOU.,2.96769531734753,0,NA,NA,Timeout,NA,HOU,BHAM,18,13
7,106,2,3,1713,3,4,34,1,0,BHAM,HOU,"J.Smith pass deep right complete to HOU 2. Catch made by O.Mitchell at HOU 2. Gain of 34 yards. O.Mitchell for 34 yards, TOUCHDOWN.",2.96769531734753,4.03230468265247,34,32,J.Smith,O.Mitchell,HOU,BHAM,18,19
7,107,2,3,1706,3,19,2,0,1,BHAM,HOU,"TWO-POINT CONVERSION ATTEMPT. V.Bolden rushed right guard to HOU 2 for yards. Tackled by D.Payne, M.Bunch at HOU 2. TWO-POINT ATTEMPT FAILS.",0.96,0.210018614968285,NA,NA,TWO-POINT,NA,HOU,BHAM,18,19
7,108,2,3,1706,NA,NA,75,0,0,BHAM,HOU,"PENALTY on BHAM-O.Mitchell, Unsportsmanlike Conduct / Offense, 12 yards, accepted. No Play.",1.17001861496828,NA,NA,NA,PENALTY,NA,HOU,BHAM,18,19
7,110,2,3,1706,NA,NA,13,0,0,HOU,BHAM,B.Aubrey kicks 63 yards from BHAM 13 to the HOU 24. W.Likely MUFFS catch. Fumble RECOVERED by HOU-W.Likely at HOU 32. W.Likely returns the kickoff. Tackled by N.Holley; C. Haney at HOU 37.,1.81273785838857,0.345941314240918,NA,NA,B.Aubrey,NA,HOU,BHAM,18,19
7,112,2,3,1700,1,10,63,1,0,HOU,BHAM,K.Bahar steps back to pass. K.Bahar pass incomplete short left intended for T.Simmons (W.Yarbary).,2.15867917262949,-0.548778316006064,NA,6,K.Bahar,T.Simmons,HOU,BHAM,18,19
7,113,2,3,1696,2,10,63,1,0,HOU,BHAM,K.Bahar steps back to pass. K.Bahar sacked at HOU 36 for -1 yards (J.Thompson),1.60990085662343,-1.24563485896215,-1,NA,K.Bahar,NA,HOU,BHAM,18,19
7,114,2,3,1655,3,11,64,1,0,HOU,BHAM,K.Bahar steps back to pass. K.Bahar pass incomplete short left intended for T.Simmons.,0.364265997661278,-1.20874326885678,NA,-1,K.Bahar,T.Simmons,HOU,BHAM,18,19
7,115,2,3,1652,4,11,64,0,0,HOU,BHAM,"A.Galitz punts 47 yards to BHAM 17, Center-T.Addington. V.Bolden returned punt from the BHAM 17. Tackled by A.Ratliff-Williams, M.Abernathy at BHAM 22.",-0.844477271195501,-0.0851277934852988,NA,NA,A.Galitz,NA,HOU,BHAM,18,19
7,116,2,3,1641,1,10,78,0,1,BHAM,HOU,"C.Marable rushed right guard to BHAM 29 for 7 yards. Tackled by M.Bunch, D.Payne at BHAM 29.",0.9296050646808,0.487276043510064,7,NA,C.Marable,NA,HOU,BHAM,18,19
7,117,2,3,1599,2,3,71,0,1,BHAM,HOU,"C.Marable rushed left guard to BHAM 35 for 6 yards. Tackled by D.Payne, R.Northrup at BHAM 35.",1.41688110819086,0.293187811039388,6,NA,C.Marable,NA,HOU,BHAM,18,19
7,118,2,3,1558,1,10,65,1,0,BHAM,HOU,"J.Smith pass short left complete to BHAM 33. Catch made by V.Bolden at BHAM 33. Gain of 2 yards. Tackled by A.Gooden, R.White at BHAM 37.",1.71006891923025,-0.341015508398414,2,-2,J.Smith,V.Bolden,HOU,BHAM,18,19
7,119,2,3,1514,2,8,63,0,1,BHAM,HOU,"C.Marable rushed up the middle to BHAM 37 for 0 yards. Tackled by D.Payne, K.Sokoli at BHAM 37.",1.36905341083184,-0.792724848724902,0,NA,C.Marable,NA,HOU,BHAM,18,19
7,120,2,3,1476,3,8,63,1,0,BHAM,HOU,"J.Smith pass deep middle complete to HOU 48. Catch made by C.Marable at HOU 48. Gain of 18 yards. Tackled by M.Bunch, M.Abernathy at HOU 45.",0.576328562106937,2.55066244094633,18,15,J.Smith,C.Marable,HOU,BHAM,18,19
7,121,2,3,1435,1,10,45,0,1,BHAM,HOU,C.Marable rushed left tackle to HOU 34 for 11 yards. Pushed out of bounds by M.Abernathy at HOU 34.,3.12699100305326,0.533303246134892,11,NA,C.Marable,NA,HOU,BHAM,18,19
7,122,2,3,1399,1,10,34,1,0,BHAM,HOU,J.Smith pass short right complete to HOU 36. Catch made by V.Bolden at HOU 36. Gain of 0 yards. Tackled by M.Bunch at HOU 34.,3.66029424918815,-0.514783657272346,0,-2,J.Smith,V.Bolden,HOU,BHAM,18,19
7,123,2,3,1362,2,10,34,1,0,BHAM,HOU,"J.Smith pass short right complete to HOU 22. Catch made by C.Angeline at HOU 22. Gain of 16 yards. Tackled by A.Lewis, M.Bunch at HOU 18.",3.14551059191581,1.76152659306535,16,12,J.Smith,C.Angeline,HOU,BHAM,18,19
7,124,2,3,1320,1,10,18,0,1,BHAM,HOU,"T.Brooks-James rushed left tackle to HOU 6 for 12 yards. Tackled by D.Payne, M.Bunch at HOU 6.",4.90703718498116,0.830597255437169,12,NA,T.Brooks-James,NA,HOU,BHAM,18,19
7,125,2,3,1276,1,6,6,0,1,BHAM,HOU,"C.Marable rushed right guard to HOU 3 for 3 yards. Tackled by C.Odom, K.Sokoli at HOU 3.",5.73763444041833,0.153669035702478,3,NA,C.Marable,NA,HOU,BHAM,18,19
7,126,2,3,1238,2,2,3,0,1,BHAM,HOU,"C.Marable rushed left tackle to HOU End Zone for 3 yards. C.Marable for 3 yards, TOUCHDOWN.",5.89130347612081,1.10869652387919,3,NA,C.Marable,NA,HOU,BHAM,18,25
7,127,2,3,1233,NA,NA,15,0,0,BHAM,HOU,B.Aubrey extra point is good.,0.94,0.0600000000000001,NA,NA,B.Aubrey,NA,HOU,BHAM,18,26
7,128,2,3,1233,NA,NA,25,0,0,HOU,BHAM,B.Aubrey kicks 61 yards from BHAM 25 to the HOU 14. I.Zuber returns the kickoff. Tackled by B.Holly; B.Aubrey at BHAM 45.,1.92151158675551,1.32358846755233,NA,NA,B.Aubrey,NA,HOU,BHAM,18,26
7,129,2,3,1223,1,10,45,0,1,HOU,BHAM,"M.Thompson rushed right tackle to BHAM 33 for 12 yards. Tackled by L.Burns, D.Tillman at BHAM 33.",3.24510005430784,0.743837737594731,12,NA,M.Thompson,NA,HOU,BHAM,18,26
7,130,2,3,1183,1,10,33,0,1,HOU,BHAM,M.Thompson rushed right tackle to BHAM 21 for 12 yards. Tackled by D.Tillman at BHAM 21.,3.98893779190257,0.875568282790482,12,NA,M.Thompson,NA,HOU,BHAM,18,26
7,131,2,3,1141,1,10,21,0,1,HOU,BHAM,"M.Thompson rushed left tackle to BHAM 20 for 1 yards. Tackled by D.Gates, N.Holley at BHAM 20.",4.86450607469305,-0.503785530105233,1,NA,M.Thompson,NA,HOU,BHAM,18,26
7,132,2,3,1094,2,9,20,1,0,HOU,BHAM,"K.Bahar pass short left complete to BHAM 15. Catch made by T.Simmons at BHAM 15. Gain of 9 yards. Pushed out of bounds by J.Tillery at BHAM 11. PENALTY on BHAM-W.Yarbary, Personal Foul / Defense, 5 yards, accepted.",4.36072054458782,1.48469181143446,9,5,K.Bahar,T.Simmons,HOU,BHAM,18,26
7,134,2,3,1071,1,6,6,0,0,HOU,BHAM,Timeout The Replay Official reviewed the targeting and the play was upheld.,5.84541235602228,0,NA,NA,Timeout,NA,HOU,BHAM,18,26
7,135,2,3,1071,1,6,6,1,0,HOU,BHAM,C.Thorson steps back to pass. C.Thorson pass incomplete short left intended for T.Simmons (B.Allen).,5.84541235602228,-0.516743290645536,NA,6,C.Thorson,T.Simmons,HOU,BHAM,18,26
7,136,2,3,1067,2,6,6,0,1,HOU,BHAM,M.Thompson rushed right tackle to BHAM 9 for -3 yards. Tackled by D.Tillman at BHAM 9.,5.32866906537674,-1.239663384913,-3,NA,M.Thompson,NA,HOU,BHAM,18,26
7,137,2,3,1022,3,9,9,0,1,HOU,BHAM,"M.Thompson rushed right tackle to BHAM 6 for 3 yards. Tackled by J.Tillery, D.Gates at BHAM 6.",4.08900568046374,-1.14783841010649,3,NA,M.Thompson,NA,HOU,BHAM,18,26
7,138,2,3,971,4,6,6,0,0,HOU,BHAM,"N.Vogel 24 yard field goal attempt is good, Center-T.Addington, Holder-A.Galitz.",2.94116727035725,0.0588327296427451,NA,NA,N.Vogel,NA,HOU,BHAM,21,26
7,139,2,3,969,NA,NA,25,0,0,BHAM,HOU,N.Vogel kicks 73 yards from HOU 25 to the BHAM 2. V.Bolden returns the kickoff. Tackled by T.Palka at BHAM 26.,1.65612510568462,-0.430723301833495,NA,NA,N.Vogel,NA,HOU,BHAM,21,26
7,140,2,3,963,1,10,74,0,1,BHAM,HOU,T.Brooks-James rushed right tackle to BHAM 31 for 5 yards. Tackled by B.Brown at BHAM 31.,1.22540180385113,0.00979008898139,5,NA,T.Brooks-James,NA,HOU,BHAM,21,26
7,141,2,3,925,2,5,69,0,0,BHAM,HOU,"PENALTY on BHAM-C.Hunt, False Start, 5 yards, accepted. No Play.",1.23519189283252,-0.609855817863718,NA,NA,PENALTY,NA,HOU,BHAM,21,26
7,143,2,3,907,2,10,74,1,0,BHAM,HOU,J.Smith steps back to pass. J.Smith pass incomplete short right intended for T.Brooks-James (M.Abernathy).,0.6253360749688,-0.759037679526955,NA,-1,J.Smith,T.Brooks-James,HOU,BHAM,21,26
7,144,2,3,900,3,10,74,0,0,BHAM,HOU,End Quarter 3,-0.133701604558155,0,NA,NA,End,NA,HOU,BHAM,21,26
7,145,2,4,900,3,10,74,1,0,BHAM,HOU,J.Smith scrambles right end to BHAM 42 for 16 yards. J.Smith ran out of bounds.,-0.133701604558155,2.31461475137621,16,NA,J.Smith,NA,HOU,BHAM,21,26
7,146,2,4,854,1,10,58,0,1,BHAM,HOU,"T.Brooks-James rushed to BHAM 46 for 4 yards. Tackled by B.Brown, D.Davis at BHAM 46.",2.18091314681806,-0.0259392303414643,4,NA,T.Brooks-James,NA,HOU,BHAM,21,26
7,147,2,4,812,2,6,54,0,1,BHAM,HOU,"T.Brooks-James rushed left tackle to HOU 41 for yards. Tackled by M.Bunch at HOU 41. PENALTY on BHAM-D.Harper, Offensive Holding, 10 yards, accepted. No Play.",2.15497391647659,-1.18100136402063,NA,NA,T.Brooks-James,NA,HOU,BHAM,21,26
7,149,2,4,784,2,16,64,1,0,BHAM,HOU,"J.Smith pass deep left complete to HOU 14. Catch made by M.Williams at HOU 14. Gain of 64 yards. M.Williams for 64 yards, TOUCHDOWN.",0.973972552455962,6.02602744754404,64,50,J.Smith,M.Williams,HOU,BHAM,21,32
7,150,2,4,775,NA,NA,15,0,0,BHAM,HOU,B.Aubrey extra point is good.,0.94,0.0600000000000001,NA,NA,B.Aubrey,NA,HOU,BHAM,21,33
7,151,2,4,775,NA,NA,25,0,0,HOU,BHAM,B.Aubrey kicks 72 yards from BHAM 25 to the HOU 3. Out of bounds.,1.82128252345137,0.987207162077539,NA,NA,B.Aubrey,NA,HOU,BHAM,21,33
7,152,2,4,775,1,10,50,1,0,HOU,BHAM,C.Thorson pass short middle complete to BHAM 44. Catch made by A.Ratliff-Williams at BHAM 44. Gain of 6 yards. Tackled by D.Gates at BHAM 44.,2.80848968552891,0.13334856426809,6,6,C.Thorson,A.Ratliff-Williams,HOU,BHAM,21,33
7,153,2,4,744,2,4,44,0,0,HOU,BHAM,TV Timeout,2.941838249797,0,NA,NA,TV,NA,HOU,BHAM,21,33
7,154,2,4,744,2,4,44,1,0,HOU,BHAM,"C.Thorson pass deep left complete to BHAM 8. Catch made by T.Simmons at BHAM 8. Gain of 44 yards. T.Simmons for 44 yards, TOUCHDOWN.",2.941838249797,4.058161750203,44,36,C.Thorson,T.Simmons,HOU,BHAM,27,33
7,155,2,4,733,NA,NA,15,0,0,HOU,BHAM,N.Vogel extra point is good.,0.94,0.0600000000000001,NA,NA,N.Vogel,NA,HOU,BHAM,28,33
7,156,2,4,733,NA,NA,25,0,0,BHAM,HOU,"N.Vogel kicks 65 yards from HOU 25 to the BHAM 10. V.Bolden returns the kickoff. Tackled by A.Ratliff-Williams, R.Northrup at BHAM 33.",1.71682500652969,-0.00984455598518252,NA,NA,N.Vogel,NA,HOU,BHAM,28,33
7,157,2,4,726,1,10,67,0,1,BHAM,HOU,T.Brooks-James rushed right tackle to BHAM 37 for 4 yards. Tackled by M.Bunch at BHAM 37.,1.70698045054451,-0.030706871766597,4,NA,T.Brooks-James,NA,HOU,BHAM,28,33
7,158,2,4,688,2,6,63,0,1,BHAM,HOU,"T.Brooks-James rushed left tackle to BHAM 41 for yards. Tackled by M.Abernathy, W.Likely at BHAM 41. PENALTY on BHAM-B.Holly, Offensive Holding, 10 yards, accepted. No Play.",1.67627357877791,-1.19803096121177,NA,NA,T.Brooks-James,NA,HOU,BHAM,28,33
