2,92,1,2,1845,3,9,9,0,0,HOU,MICH,Timeout #1 by HOU.,3.08080666512251,0,NA,NA,Timeout,NA,MICH,HOU,0,17
2,93,1,2,1845,3,9,9,1,0,HOU,MICH,C.Thorson steps back to pass. C.Thorson pass incomplete short middle intended for B.Barnes (O.Stewart).,3.08080666512251,-0.507812038587872,NA,9,C.Thorson,B.Barnes,MICH,HOU,0,17
2,94,1,2,1840,4,9,9,0,0,HOU,MICH,"N.Vogel 27 yard field goal attempt is no good, Center-T.Addington, Holder-A.Galitz.",2.57299462653464,-2.86358975677285,NA,NA,N.Vogel,NA,MICH,HOU,0,17
2,95,1,2,1838,1,10,80,0,1,MICH,HOU,"C.Scarlett rushed right guard to MICH 23 for 3 yards. Tackled by D.Payne, R.Northrup at MICH 23.",0.290595130238216,-0.24879050074378,3,NA,C.Scarlett,NA,MICH,HOU,0,17
2,96,1,2,1804,2,7,77,0,1,MICH,HOU,"C.Scarlett rushed up the middle to MICH 29 for 6 yards. Tackled by R.Northrup, D.Payne at MICH 29.",0.0418046294944361,-0.0418046294944361,6,NA,C.Scarlett,NA,MICH,HOU,0,17
2,97,1,2,1800,NA,NA,NA,0,0,MICH,HOU,End Quarter 2,0,0,NA,NA,End,NA,MICH,HOU,0,17
2,98,1,3,1800,NA,NA,25,0,0,MICH,HOU,N.Vogel kicks 68 yards from HOU 25 to the MICH 7. C.Scarlett returns the kickoff. Tackled by M.Bunch; A.Lewis at MICH 26.,2.02943554613739,-0.397662087809294,NA,NA,N.Vogel,NA,MICH,HOU,0,17
2,99,1,3,1795,1,10,74,0,1,MICH,HOU,S.Scott rushed up the middle to MICH 32 for 6 yards. Tackled by M.Abernathy; D.Davis at MICH 32.,1.6317734583281,0.294892553705722,6,NA,S.Scott,NA,MICH,HOU,0,17
2,100,1,3,1761,2,4,68,0,1,MICH,HOU,S.Scott rushed right tackle to MICH 45 for 13 yards. Tackled by D.Payne at MICH 45.,1.92666601203382,0.893032098188996,13,NA,S.Scott,NA,MICH,HOU,0,17
2,101,1,3,1732,1,10,55,0,1,MICH,HOU,S.Scott rushed left guard to HOU 46 for 9 yards. Tackled by D.Payne; A.Lewis at HOU 46.,2.81969811022282,0.781015308108181,9,NA,S.Scott,NA,MICH,HOU,0,17
2,102,1,3,1700,2,1,46,0,1,MICH,HOU,C.Scarlett rushed left tackle to HOU 36 for 10 yards. Tackled by D.Davis at HOU 36.,3.600713418331,0.353704393142834,10,NA,C.Scarlett,NA,MICH,HOU,0,17
2,103,1,3,1656,1,10,36,1,0,MICH,HOU,S.Patterson pass short right complete to HOU 27. Catch made by C.Scarlett at HOU 27. Gain of 9 yards. Tackled by D.Payne at HOU 27.,3.95441781147383,0.76078908983618,9,9,S.Patterson,C.Scarlett,MICH,HOU,0,17
2,104,1,3,1624,2,1,27,0,1,MICH,HOU,S.Patterson rushed up the middle to HOU 23 for 4 yards. Tackled by A.Soroh at HOU 23.,4.71520690131001,0.170479472260922,4,NA,S.Patterson,NA,MICH,HOU,0,17
2,105,1,3,1588,1,10,23,0,1,MICH,HOU,"S.Scott rushed right guard to HOU 21 for 2 yards. Tackled by D.Payne, R.Northrup at HOU 21.",4.88568637357093,-0.428433211287484,2,NA,S.Scott,NA,MICH,HOU,0,17
2,106,1,3,1560,2,8,21,1,0,MICH,HOU,S.Patterson pass short right complete to HOU 8. Catch made by L.Lenoir at HOU 8. Gain of 13 yards. Pushed out of bounds by J.Summers at HOU 8.,4.45725316228345,1.21839845651994,13,13,S.Patterson,L.Lenoir,MICH,HOU,0,17
2,107,1,3,1520,1,8,8,0,1,MICH,HOU,"S.Scott rushed right guard to HOU 8 for 0 yards. Tackled by R.Northrup, C.Thomas at HOU 8.",5.67565161880339,-0.571145972877275,0,NA,S.Scott,NA,MICH,HOU,0,17
2,108,1,3,1482,2,8,8,1,0,MICH,HOU,"S.Patterson pass short left complete to HOU End Zone. Catch made by L.Lenoir at HOU End Zone. Gain of 8 yards. L.Lenoir for 8 yards, TOUCHDOWN.",5.10450564592611,1.89549435407389,8,8,S.Patterson,L.Lenoir,MICH,HOU,6,17
2,109,1,3,1475,NA,NA,2,0,0,MICH,HOU,Timeout #1 by MICH.,0.96,NA,NA,NA,Timeout,NA,MICH,HOU,6,17
2,110,1,3,1475,NA,NA,2,1,0,MICH,HOU,TWO-POINT CONVERSION ATTEMPT. S.Patterson steps back to pass. S.Patterson pass incomplete short right intended for J.Walker. TWO-POINT ATTEMPT FAILS.,0.96,-0.96,NA,2,TWO-POINT,J.Walker,MICH,HOU,6,17
2,111,1,3,1475,NA,NA,25,0,0,HOU,MICH,"M.Carrizosa kicks 65 yards from MICH 25 to the HOU 10. W.Likely returns the kickoff. Tackled by O.Stewart, A.Adeoye at HOU 35.",1.66682081110775,0.0386690963059664,NA,NA,M.Carrizosa,NA,MICH,HOU,6,17
2,112,1,3,1468,1,10,65,1,0,HOU,MICH,C.Thorson pass short left complete to HOU 38. Catch made by J.Ward at HOU 38. Gain of 3 yards. Tackled by J.Houston at HOU 38.,1.70548990741372,-0.194730009417981,3,3,C.Thorson,J.Ward,MICH,HOU,6,17
2,113,1,3,1438,2,7,62,0,1,HOU,MICH,M.Thompson rushed right tackle to HOU 40 for 2 yards. Tackled by T.Myrick at HOU 40.,1.51075989799574,-0.587533154059201,2,NA,M.Thompson,NA,MICH,HOU,6,17
2,114,1,3,1398,3,5,60,0,0,HOU,MICH,"PENALTY on HOU-T.Higby, False Start, 5 yards, accepted. No Play.",0.923226743936539,-0.610665820538998,NA,NA,PENALTY,NA,MICH,HOU,6,17
2,116,1,3,1370,3,10,65,0,0,HOU,MICH,"PENALTY on HOU-C.Thorson, Delay of Game, 5 yards, accepted. No Play.",0.312560923397541,-0.651303395628929,NA,NA,PENALTY,NA,MICH,HOU,6,17
2,118,1,3,1354,3,15,70,1,0,HOU,MICH,C.Thorson pass short middle complete to HOU 32. Catch made by J.Ward at HOU 32. Gain of 9 yards. Tackled by J.Houston at HOU 39.,-0.338742472231388,-0.42431693058461,9,2,C.Thorson,J.Ward,MICH,HOU,6,17
2,119,1,3,1318,4,6,61,0,0,HOU,MICH,"A.Galitz punts 41 yards to MICH 20, Center-T.Addington. Fair catch by J.Walker. PENALTY on HOU-T.Palka, Kick Catch Interference, 15 yards, accepted.",-0.763059402815998,-1.20909756259061,NA,NA,A.Galitz,NA,MICH,HOU,6,17
2,121,1,3,1318,1,10,65,0,1,MICH,HOU,"C.Scarlett rushed right guard to MICH 41 for 6 yards. Tackled by A.Gooden, R.Northrup at MICH 41.",1.97215696540661,0.213956438237801,6,NA,C.Scarlett,NA,MICH,HOU,6,17
2,122,1,3,1285,2,4,59,1,0,MICH,HOU,S.Patterson steps back to pass. S.Patterson pass incomplete short right intended for D.Ross.,2.18611340364441,-0.88108998700045,NA,4,S.Patterson,D.Ross,MICH,HOU,6,17
2,123,1,3,1281,3,4,59,1,0,MICH,HOU,S.Patterson pass short middle complete to MICH 47. Catch made by J.Badet at MICH 47. Gain of 12 yards. Tackled by M.Abernathy at HOU 47.,1.30502341664396,1.85426885436755,12,6,S.Patterson,J.Badet,MICH,HOU,6,17
2,124,1,3,1249,1,10,47,0,1,MICH,HOU,C.Scarlett rushed right guard to HOU 41 for 6 yards. Tackled by A.Lewis; M.Bunch at HOU 41.,3.15929227101151,0.195038657053374,6,NA,C.Scarlett,NA,MICH,HOU,6,17
2,125,1,3,1220,2,4,41,0,1,MICH,HOU,C.Scarlett rushed right guard to HOU 36 for 5 yards. Tackled by A.Lewis at HOU 36.,3.35433092806488,0.478842075564899,5,NA,C.Scarlett,NA,MICH,HOU,6,17
2,126,1,3,1193,1,10,36,0,1,MICH,HOU,"S.Scott rushed left guard to HOU 34 for 2 yards. Tackled by D.Payne, A.Victor at HOU 34.",3.83317300362978,-0.510198553442024,2,NA,S.Scott,NA,MICH,HOU,6,17
2,127,1,3,1144,2,8,34,1,0,MICH,HOU,"S.Patterson steps back to pass. S.Patterson sacked at HOU 35 for -1 yards (D.Payne) PENALTY on HOU-C.Odom, Illegal Use of Hands / Defense, 5 yards, accepted. No Play.",3.32297445018776,0.971772079705261,-1,NA,S.Patterson,NA,MICH,HOU,6,17
2,129,1,3,1126,1,10,29,0,1,MICH,HOU,"S.Scott rushed left guard to HOU 27 for 2 yards. Tackled by M.Bunch, J.Avery at HOU 27.",4.29474652989302,-0.342094557126984,2,NA,S.Scott,NA,MICH,HOU,6,17
2,130,1,3,1098,2,8,27,1,0,MICH,HOU,S.Patterson pass short right complete to HOU 35. Catch made by J.Magnifico at HOU 35. Gain of -3 yards. Pushed out of bounds by A.Soroh at HOU 30.,3.95265197276603,-1.23352065490326,-3,-8,S.Patterson,J.Magnifico,MICH,HOU,6,17
2,131,1,3,1053,3,11,30,1,0,MICH,HOU,S.Patterson pass short right complete to HOU 31. Catch made by S.Scott at HOU 31. Gain of 5 yards. Tackled by J.Avery at HOU 25.,2.71913131786278,-0.462182671821211,5,-1,S.Patterson,S.Scott,MICH,HOU,6,17
2,132,1,3,1011,4,6,25,0,0,MICH,HOU,"M.Carrizosa 43 yard field goal attempt is no good, Center-S.Griffin, Holder-J.Walker.",2.25694864604156,-3.90132726135198,NA,NA,M.Carrizosa,NA,MICH,HOU,6,17
2,133,1,3,1005,1,10,67,0,1,HOU,MICH,"D.Dawkins rushed left tackle to HOU 38 for 5 yards. Tackled by S.Williams, C.Walker at HOU 38.",1.64437861531042,0.0640935893170536,5,NA,D.Dawkins,NA,MICH,HOU,6,17
2,134,1,3,970,2,5,62,0,1,HOU,MICH,"D.Dawkins rushed left guard to HOU 39 for 1 yards. Tackled by C.Walker, O.Stewart at HOU 39.",1.70847220462747,-0.656081170774996,1,NA,D.Dawkins,NA,MICH,HOU,6,17
2,135,1,3,932,3,4,61,0,0,HOU,MICH,"PENALTY on HOU-J.Yarbrough, False Start, 5 yards, accepted. No Play.",1.05239103385247,-0.68790179817006,NA,NA,PENALTY,NA,MICH,HOU,6,17
2,137,1,3,913,3,9,66,0,0,HOU,MICH,"PENALTY on HOU-J.Yarbrough, False Start, 5 yards, accepted. No Play.",0.364489235682413,-0.665961397113279,NA,NA,PENALTY,NA,MICH,HOU,6,17
2,139,1,3,900,3,14,71,0,0,HOU,MICH,End Quarter 3,-0.301472161430866,0,NA,NA,End,NA,MICH,HOU,6,17
2,140,1,4,900,3,14,71,1,0,HOU,MICH,C.Thorson pass short left complete to HOU 33. Catch made by J.Ward at HOU 33. Gain of 9 yards. Tackled by J.Putu at HOU 38.,-0.301472161430866,-0.446059753187001,9,4,C.Thorson,J.Ward,MICH,HOU,6,17
2,141,1,4,868,4,5,62,0,0,HOU,MICH,"A.Galitz punts 28 yards to MICH 34, Center-T.Addington. Out of bounds.",-0.747531914617866,-1.04598785750568,NA,NA,A.Galitz,NA,MICH,HOU,6,17
2,142,1,4,861,1,10,66,1,0,MICH,HOU,S.Patterson pass deep right complete to HOU 47. Catch made by D.Ross at HOU 47. Gain of 29 yards. Tackled by A.Soroh at HOU 37.,1.79351977212355,1.85460343386512,29,19,S.Patterson,D.Ross,MICH,HOU,6,17
2,143,1,4,847,1,10,37,0,0,MICH,HOU,TV Timeout,3.64812320598867,0,NA,NA,TV,NA,MICH,HOU,6,17
2,144,1,4,847,1,10,37,0,1,MICH,HOU,C.Scarlett rushed left guard to HOU 33 for 4 yards. Tackled by C.Odom at HOU 33.,3.64812320598867,-0.12483885884285,4,NA,C.Scarlett,NA,MICH,HOU,6,17
2,145,1,4,808,2,6,33,0,1,MICH,HOU,S.Patterson rushed left tackle to HOU 23 for 10 yards. Tackled by M.Abernathy at HOU 23.,3.52328434714582,1.11840862879762,10,NA,S.Patterson,NA,MICH,HOU,6,17
2,146,1,4,786,1,10,23,0,1,MICH,HOU,C.Scarlett rushed right guard to HOU 20 for 3 yards. Tackled by J.Avery at HOU 20.,4.64169297594344,-0.313768553663976,3,NA,C.Scarlett,NA,MICH,HOU,6,17
2,147,1,4,753,2,7,20,1,0,MICH,HOU,S.Patterson pass short right complete to HOU 22. Catch made by D.Ross at HOU 22. Gain of 1 yards. Tackled by D.Payne at HOU 19.,4.32792442227947,-0.578295133949723,1,-2,S.Patterson,D.Ross,MICH,HOU,6,17
2,148,1,4,710,3,6,19,1,0,MICH,HOU,S.Patterson steps back to pass. S.Patterson pass incomplete short right intended for M.Baugh.,3.74962928832974,-1.15603305859258,NA,2,S.Patterson,M.Baugh,MICH,HOU,6,17
2,149,1,4,706,4,6,19,1,0,MICH,HOU,S.Patterson pass short middle complete to HOU 9. Catch made by L.Lenoir at HOU 9. Gain of 12 yards. Tackled by J.Summers at HOU 7.,2.59359622973716,2.9789080847404,12,10,S.Patterson,L.Lenoir,MICH,HOU,6,17
2,150,1,4,681,1,7,7,0,1,MICH,HOU,"S.Scott rushed up the middle to HOU 5 for 2 yards. Tackled by M.Bunch, R.Northrup at HOU 5.",5.57250431447756,-0.202142886002548,2,NA,S.Scott,NA,MICH,HOU,6,17
2,151,1,4,620,2,5,5,0,1,MICH,HOU,"S.Scott rushed to HOU 1 for 3 yards. Tackled by HOU at HOU 1. The Replay Official reviewed the runner broke the plane and the play was overturned. S.Scott rushed up the middle to HOU End Zone for 5 yards. S.Scott for 5 yards, TOUCHDOWN.",5.37036142847501,1.62963857152499,5,NA,S.Scott,NA,MICH,HOU,12,17
2,152,1,4,620,NA,NA,2,0,1,MICH,HOU,"TWO-POINT CONVERSION ATTEMPT. S.Scott rushed left guard to HOU 2 for yards. Tackled by M.Abernathy, M.Bunch at HOU 2. TWO-POINT ATTEMPT FAILS.",0.96,-0.96,NA,NA,TWO-POINT,NA,MICH,HOU,12,17
2,153,1,4,620,NA,NA,25,0,0,HOU,MICH,M.Carrizosa kicks 67 yards from MICH 25 to the HOU 8. W.Likely returns the kickoff. Pushed out of bounds by D.Ross at HOU 40.,1.66978282434866,0.50194530072622,NA,NA,M.Carrizosa,NA,MICH,HOU,12,17
2,154,1,4,613,1,10,60,1,0,HOU,MICH,"C.Thorson pass deep left INTERCEPTED at MICH 41. Intercepted by J.Houston at MICH 41. Tackled by T.Palka, B.Hitner at HOU 43.",2.17172812507488,-5.27419042622205,NA,19,C.Thorson,NA,MICH,HOU,12,17
2,155,1,4,601,1,10,43,0,1,MICH,HOU,S.Pollard FUMBLES (aborted). Fumble RECOVERED by MICH-S.Patterson at MICH 47. S.Patterson rushed up the middle to MICH 47 for yards. Tackled by A.Victor at MICH 47.,3.10246230114717,-1.31395230896305,NA,NA,S.Pollard,NA,MICH,HOU,12,17
2,157,1,4,565,2,20,53,1,0,MICH,HOU,S.Patterson steps back to pass. S.Patterson pass incomplete short right intended for D.Ross.,1.78850999218412,-0.911000634776428,NA,5,S.Patterson,D.Ross,MICH,HOU,12,17
2,158,1,4,560,3,20,53,0,0,MICH,HOU,Timeout #2 by MICH.,0.877509357407689,0,NA,NA,Timeout,NA,MICH,HOU,12,17
2,159,1,4,560,3,20,53,1,0,MICH,HOU,S.Patterson pass deep right complete to HOU 34. Catch made by L.Lenoir at HOU 34. Gain of 19 yards. L.Lenoir ran out of bounds.,0.877509357407689,1.39200970402453,19,19,S.Patterson,L.Lenoir,MICH,HOU,12,17
2,160,1,4,540,4,1,34,0,1,MICH,HOU,S.Patterson rushed up the middle to HOU 34 for 0 yards. Tackled by D.Payne at HOU 34.,2.26951906143222,-4.09909481939394,0,NA,S.Patterson,NA,MICH,HOU,12,17
2,161,1,4,537,1,10,66,0,1,HOU,MICH,"M.Thompson rushed left guard to HOU 37 for 3 yards. Tackled by J.Houston, K.Tyson at HOU 37.",1.82957575796172,-0.0803529608529061,3,NA,M.Thompson,NA,MICH,HOU,12,17
2,162,1,4,493,2,7,63,0,1,HOU,MICH,M.Thompson rushed left tackle to HOU 44 for 7 yards. Pushed out of bounds by S.Williams at HOU 44.,1.74922279710881,0.865445045987144,7,NA,M.Thompson,NA,MICH,HOU,12,17
2,163,1,4,445,1,10,56,0,1,HOU,MICH,D.Dawkins rushed right guard to HOU 44 for 0 yards. Tackled by K.Tyson; C.Walker at HOU 44.,2.61466784309596,-0.473615676164627,0,NA,D.Dawkins,NA,MICH,HOU,12,17
2,164,1,4,415,2,10,56,1,0,HOU,MICH,"K.Bahar pass short left complete to HOU 49. Catch made by J.Ward at HOU 49. Gain of 8 yards. Tackled by J.Houston, J.Burrell at MICH 48.",2.14105216693133,0.340301160002127,8,5,K.Bahar,J.Ward,MICH,HOU,12,17
2,165,1,4,376,3,2,48,0,1,HOU,MICH,"D.Dawkins rushed up the middle to MICH 48 for 0 yards. Tackled by T.Myrick, F.Ginda at MICH 48.",2.48135332693346,-1.75078535592183,0,NA,D.Dawkins,NA,MICH,HOU,12,17
2,166,1,4,319,4,2,48,0,0,HOU,MICH,"A.Galitz punts 38 yards to MICH 10, Center-T.Addington. Fair catch by J.Walker.",0.730567971011624,-0.739401918137446,NA,NA,A.Galitz,NA,MICH,HOU,12,17
2,167,1,4,312,1,10,90,1,0,MICH,HOU,S.Patterson pass deep right complete to MICH 25. Catch made by L.Lenoir at MICH 25. Gain of 15 yards. L.Lenoir ran out of bounds.,0.00883394712582231,1.06218637654092,15,15,S.Patterson,L.Lenoir,MICH,HOU,12,17
2,168,1,4,279,1,10,75,1,0,MICH,HOU,S.Patterson steps back to pass. S.Patterson pass incomplete short right intended for L.Lenoir.,1.07102032366674,-0.579383500386029,NA,-1,S.Patterson,L.Lenoir,MICH,HOU,12,17
2,169,1,4,274,2,10,75,0,1,MICH,HOU,C.Scarlett rushed right tackle to MICH 33 for 8 yards. Tackled by A.Gooden; R.Northrup at MICH 33.,0.491636823280714,0.442542278091423,8,NA,C.Scarlett,NA,MICH,HOU,12,17
2,170,1,4,253,3,2,67,0,1,MICH,HOU,S.Patterson rushed right guard to MICH 37 for 4 yards. Tackled by A.Gooden; R.Northrup at MICH 37.,0.934179101372138,0.824519892339595,4,NA,S.Patterson,NA,MICH,HOU,12,17
2,171,1,4,221,1,10,63,1,0,MICH,HOU,S.Patterson pass short right complete to HOU 49. Catch made by D.Ross at HOU 49. Gain of 14 yards. Tackled by M.Abernathy at HOU 49.,1.75869899371173,0.928752768668346,14,14,S.Patterson,D.Ross,MICH,HOU,12,17
2,172,1,4,183,1,10,49,0,1,MICH,HOU,L.Lenoir rushed left end to HOU 42 for 7 yards. Tackled by R.Northrup at HOU 42.,2.68745176238008,0.293312629160937,7,NA,L.Lenoir,NA,MICH,HOU,12,17
2,173,1,4,147,2,3,42,0,1,MICH,HOU,"S.Scott rushed right guard to HOU 41 for 1 yards. Tackled by D.Davis, A.Victor at HOU 41.",2.98076439154102,-0.296414827578701,1,NA,S.Scott,NA,MICH,HOU,12,17
2,174,1,4,120,3,2,41,0,0,MICH,HOU,Two minute warning.,2.68434956396231,0,NA,NA,Two,NA,MICH,HOU,12,17
2,175,1,4,120,3,2,41,0,1,MICH,HOU,"S.Scott rushed right tackle to HOU 37 for 4 yards. Tackled by D.Davis, M.Bunch at HOU 37.",2.68434956396231,0.578146545682102,4,NA,S.Scott,NA,MICH,HOU,12,17
2,176,1,4,95,1,10,37,1,0,MICH,HOU,S.Patterson pass short right complete to HOU 33. Catch made by J.Walker at HOU 33. Gain of 4 yards. Tackled by A.Soroh at HOU 33.,3.26249610964442,-0.0752903803950176,4,4,S.Patterson,J.Walker,MICH,HOU,12,17
2,177,1,4,70,2,6,33,1,0,MICH,HOU,S.Patterson pass deep right complete to HOU 18. Catch made by J.Walker at HOU 18. Gain of 19 yards. Tackled by M.Bunch at HOU 14.,3.1872057292494,1.57549826387549,19,15,S.Patterson,J.Walker,MICH,HOU,12,17
2,178,1,4,50,1,10,14,0,1,MICH,HOU,S.Patterson FUMBLES (aborted). Fumble RECOVERED by MICH-S.Patterson at HOU 21. S.Patterson rushed up the middle to HOU 21 for yards. Tackled by C.Thomas at HOU 21.,4.76270399312489,-1.53394038317492,NA,NA,S.Patterson,NA,MICH,HOU,12,17
2,180,1,4,46,2,17,21,0,0,MICH,HOU,Timeout #3 by MICH.,3.22876360994997,0,NA,NA,Timeout,NA,MICH,HOU,12,17
2,181,1,4,46,2,17,21,1,0,MICH,HOU,S.Patterson steps back to pass. S.Patterson sacked at HOU 30 for -9 yards (C.Odom),3.22876360994997,-1.04230335907778,-9,NA,S.Patterson,NA,MICH,HOU,12,17
2,182,1,4,18,3,26,30,1,0,MICH,HOU,S.Patterson steps back to pass. S.Patterson pass incomplete deep left intended for J.Walker.,2.18646025087219,-0.236327303922735,NA,30,S.Patterson,J.Walker,MICH,HOU,12,17
2,183,1,4,9,4,26,30,1,0,MICH,HOU,"S.Patterson steps back to pass. S.Patterson pass incomplete deep right intended for L.Pettway. PENALTY on MICH-T.Koroma, Chop Block, 15 yards, declined.",1.95013294694945,-2.13249238577555,NA,30,S.Patterson,L.Pettway,MICH,HOU,12,17
2,185,1,4,1,1,10,55,0,0,HOU,MICH,K.Bahar kneels at the HOU 43.,0.182359438826097,-0.182359438826097,NA,NA,K.Bahar,NA,MICH,HOU,12,17
2,186,1,4,0,NA,NA,NA,0,0,HOU,MICH,End Game,0,0,NA,NA,End,NA,MICH,HOU,12,17
3,1,1,1,3600,NA,NA,25,0,0,PHI,NO,A.MacGinnis kicks 66 yards from NO 25 to the PHI 9. D.Holland returns the kickoff. Tackled by M.Stevens at PHI 26.,1.31759998621419,-0.301645609084517,NA,NA,A.MacGinnis,NA,NO,PHI,0,0
3,2,1,1,3573,1,10,74,1,0,PHI,NO,B.Scott steps back to pass. B.Scott sacked at PHI 21 for -5 yards (D.Bellamy),1.01595437712967,-1.42447661282495,-5,NA,B.Scott,NA,NO,PHI,0,0
3,3,1,1,3557,2,15,79,1,0,PHI,NO,"B.Scott pass short left complete to PHI 25. Catch made by D.Holland at PHI 25. Gain of 4 yards. Tackled by D.Jacobs, K.Washington at PHI 25.",-0.408522235695273,-0.203502740245312,4,4,B.Scott,D.Holland,NO,PHI,0,0
3,4,1,1,3519,3,11,75,1,0,PHI,NO,B.Scott pass short left complete to PHI 26. Catch made by D.Overton at PHI 26. Gain of 16 yards. Tackled by K.Washington at PHI 41.,-0.612024975940585,2.5828174771741,16,1,B.Scott,D.Overton,NO,PHI,0,0
3,5,1,1,3477,1,10,59,1,0,PHI,NO,B.Scott steps back to pass. B.Scott pass incomplete short middle intended for B.Howard.,1.97079250123352,-0.53290948504582,NA,5,B.Scott,B.Howard,NO,PHI,0,0
3,6,1,1,3473,2,10,59,1,0,PHI,NO,"B.Scott steps back to pass. B.Scott pass incomplete short middle intended for D.Overton. PENALTY on NO-S.Miller, Roughing the Passer, 15 yards, accepted. No Play.",1.4378830161877,1.52096832613461,NA,5,B.Scott,D.Overton,NO,PHI,0,0
3,8,1,1,3470,1,10,44,1,0,PHI,NO,B.Scott pass short right complete to NO 44. Catch made by C.Rowland at NO 44. Gain of 6 yards. Tackled by A.Alexander at NO 38.,2.9588513423223,0.293692713137716,6,0,B.Scott,C.Rowland,NO,PHI,0,0
3,9,1,1,3426,2,4,38,0,1,PHI,NO,"D.Holland rushed right tackle to NO 24 for 14 yards. Tackled by K.Washington, A.Alexander at NO 24.",3.25254405546002,1.30968247831333,14,NA,D.Holland,NA,NO,PHI,0,0
3,10,1,1,3388,1,10,24,1,0,PHI,NO,B.Scott pass short right complete to NO 30. Catch made by D.Holland at NO 30. Gain of -2 yards. Tackled by V.Diggs at NO 26.,4.56222653377336,-0.93461544229649,-2,-6,B.Scott,D.Holland,NO,PHI,0,0
3,11,1,1,3346,2,12,26,1,0,PHI,NO,B.Scott steps back to pass. B.Scott pass incomplete deep left intended for J.Suell (K.Washington).,3.62761109147687,-0.617963249213062,NA,22,B.Scott,J.Suell,NO,PHI,0,0
3,12,1,1,3341,3,12,26,1,0,PHI,NO,B.Scott steps back to pass. B.Scott sacked at NO 27 for -1 yards (D.Bellamy),3.0096478422638002,-0.927709976793267,-1,NA,B.Scott,NA,NO,PHI,0,0
3,13,1,1,3299,4,12,27,0,0,PHI,NO,"M.Mengel 45 yard field goal attempt is no good, Center-R.Navarro, Holder-C.Cookus.",2.08193786547054,-4.12201490520965,NA,NA,M.Mengel,NA,NO,PHI,0,0
3,14,1,1,3295,1,10,65,1,0,NO,PHI,K.Sloter scrambles right tackle to NO 41 for 6 yards. Tackled by J.Banderas at NO 41.,2.04007703973912,0.281225016573444,6,NA,K.Sloter,NA,NO,PHI,0,0
3,15,1,1,3265,2,4,59,0,1,NO,PHI,T.Logan rushed right tackle to NO 42 for 1 yards. Tackled by C.Brown at NO 42.,2.32130205631256,-0.725935250986367,1,NA,T.Logan,NA,NO,PHI,0,0
3,16,1,1,3230,3,3,58,0,1,NO,PHI,T.Logan rushed up the middle to NO 43 for 1 yards. Tackled by F.Akinmoladun at NO 43.,1.59536680532619,-1.53611424285918,1,NA,T.Logan,NA,NO,PHI,0,0
3,17,1,1,3196,4,2,57,0,0,NO,PHI,"M.White punts 38 yards to PHI 19, Center-T.Bernard. Out of bounds.",0.0592525624670088,-0.610440817195922,NA,NA,M.White,NA,NO,PHI,0,0
3,18,1,1,3189,1,10,81,1,0,PHI,NO,"B.Scott pass short right complete to PHI 18. Catch made by B.Howard at PHI 18. Gain of 4 yards. Tackled by V.Diggs, J.Elder at PHI 23.",0.551188254728913,-0.21166875353083,4,-1,B.Scott,B.Howard,NO,PHI,0,0
3,19,1,1,3149,2,6,77,1,0,PHI,NO,B.Scott pass short left complete to PHI 27. Catch made by C.Rowland at PHI 27. Gain of 7 yards. Pushed out of bounds by M.Stevens at PHI 30.,0.339519501198083,0.96921799890697,7,4,B.Scott,C.Rowland,NO,PHI,0,0
3,20,1,1,3112,1,10,70,0,1,PHI,NO,"D.Holland rushed right tackle to PHI 27 for -3 yards. Tackled by K.Tongamoa, J.Fernandez at PHI 27.",1.30873750010505,-1.07900021737441,-3,NA,D.Holland,NA,NO,PHI,0,0
3,21,1,1,3076,2,13,73,0,1,PHI,NO,M.Colburn rushed left guard to PHI 32 for 5 yards. Tackled by J.Fernandez at PHI 32.,0.229737282730639,-0.100476220715791,5,NA,M.Colburn,NA,NO,PHI,0,0
3,22,1,1,3036,3,8,68,1,0,PHI,NO,"B.Scott pass short middle INTERCEPTED at PHI 37. Intercepted by V.Diggs at PHI 37. V.Diggs for 37 yards, TOUCHDOWN.",0.129261062014848,-7.12926106201485,NA,5,B.Scott,NA,NO,PHI,6,0
3,23,1,1,3028,NA,NA,85,0,0,NO,NO,A.MacGinnis extra point is good.,0.94,0.0600000000000001,NA,NA,A.MacGinnis,NA,NO,PHI,7,0
3,24,1,1,3028,NA,NA,25,0,0,PHI,NO,A.MacGinnis kicks 71 yards from NO 25 to the PHI 4. D.Holland MUFFS catch. Fumble RECOVERED by PHI-D.Holland at PHI End Zone. D.Holland returns the kickoff. Tackled by J.Elder at PHI 23.,1.48396147461608,-0.756670738104731,NA,NA,A.MacGinnis,NA,NO,PHI,7,0
3,26,1,1,3019,1,10,77,1,0,PHI,NO,B.Scott pass short left complete to PHI 18. Catch made by M.Colburn at PHI 18. Gain of 9 yards. Tackled by J.Fernandez at PHI 32.,0.72729073651135,1.0282709565945,9,-5,B.Scott,M.Colburn,NO,PHI,7,0
3,27,1,1,2976,2,1,68,0,1,PHI,NO,"M.Colburn rushed left tackle to PHI 33 for 1 yards. Tackled by N.Chavis, D.Bellamy at PHI 33.",1.75556169310585,-0.25624636746943,1,NA,M.Colburn,NA,NO,PHI,7,0
3,28,1,1,2968,1,10,67,0,0,PHI,NO,"PENALTY on NO-K.Washington, Unsportsmanlike Conduct / Defense, 15 yards, accepted. No Play.",1.49931532563642,1.00857747951522,NA,NA,PENALTY,NA,NO,PHI,7,0
3,30,1,1,2947,1,10,52,1,0,PHI,NO,B.Scott pass short right complete to PHI 44. Catch made by M.Colburn at PHI 44. Gain of 21 yards. Tackled by A.Alexander at NO 31.,2.50789280515164,1.47498595144134,21,-4,B.Scott,M.Colburn,NO,PHI,7,0
3,31,1,1,2905,1,10,31,0,1,PHI,NO,"M.Colburn rushed right tackle to NO 30 for 1 yards. Tackled by S.Miller, J.Fernandez at NO 30.",3.98287875659298,-0.448512268718332,1,NA,M.Colburn,NA,NO,PHI,7,0
3,32,1,1,2865,2,9,30,0,1,PHI,NO,M.Colburn rushed left tackle to NO 29 for 1 yards. Tackled by J.Fernandez at NO 29.,3.53436648787465,-0.519047982990742,1,NA,M.Colburn,NA,NO,PHI,7,0
3,33,1,1,2826,3,8,29,1,0,PHI,NO,B.Scott pass short right complete to NO 26. Catch made by C.Rowland at NO 26. Gain of 18 yards. Tackled by M.Patterson at NO 11.,3.01531850488391,2.15746343880892,18,3,B.Scott,C.Rowland,NO,PHI,7,0
3,34,1,1,2789,1,10,11,1,0,PHI,NO,B.Scott steps back to pass. B.Scott sacked at NO 16 for -5 yards (D.Bellamy),5.17278194369283,-1.19701095821802,-5,NA,B.Scott,NA,NO,PHI,7,0
3,35,1,1,2752,2,15,16,0,1,PHI,NO,"D.Holland rushed left end to NO 23 for -7 yards. Tackled by V.Diggs at NO 23. PENALTY on NO-V.Diggs, Personal Foul / Defense, 15 yards, accepted.",3.97577098547481,1.48057753773173,-7,NA,D.Holland,NA,NO,PHI,7,0
3,37,1,1,2714,1,8,8,0,1,PHI,NO,M.Colburn rushed left guard to NO 3 for 5 yards. Tackled by A.Alexander at NO 3.,5.45634852320654,0.273721140867565,5,NA,M.Colburn,NA,NO,PHI,7,0
3,38,1,1,2700,2,3,3,0,0,PHI,NO,End Quarter 1,5.73006966407411,0,NA,NA,End,NA,NO,PHI,7,0
3,39,1,2,2700,2,3,3,1,0,PHI,NO,B.Scott pass short left complete to NO 3. Catch made by B.Howard at NO 3. Gain of 0 yards. Tackled by A.Alexander at NO 3.,5.73006966407411,-0.983880660671275,0,0,B.Scott,B.Howard,NO,PHI,7,0
3,40,1,2,2665,3,3,3,0,1,PHI,NO,"M.Colburn rushed right tackle to NO 3 for 0 yards. Tackled by A.Saint-Amour, S.Miller at NO 3.",4.74618900340283,-1.73199044319335,0,NA,M.Colburn,NA,NO,PHI,7,0
3,41,1,2,2625,4,3,3,1,0,PHI,NO,B.Scott steps back to pass. B.Scott pass incomplete short right intended for M.Colburn (J.Elder).,3.01419856020948,-3.09517842525383,NA,-1,B.Scott,M.Colburn,NO,PHI,7,0
3,42,1,2,2621,1,10,97,0,1,NO,PHI,J.Ellis rushed right guard to NO 9 for 6 yards. Tackled by E.Worthington at NO 9.,0.0809798650443554,0.113694656407461,6,NA,J.Ellis,NA,NO,PHI,7,0
3,43,1,2,2594,2,4,91,0,0,NO,PHI,"PENALTY on NO-E.Bibbs, False Start, 5 yards, accepted. No Play.",0.194674521451816,-0.635495778406039,NA,NA,PENALTY,NA,NO,PHI,7,0
3,45,1,2,2569,2,9,96,1,0,NO,PHI,"K.Sloter pass short middle complete to NO 14. Catch made by S.Cannella at NO 14. Gain of 16 yards. Tackled by J.Banderas, C.Brown at NO 20.",-0.440821256954223,1.48680551955476,16,10,K.Sloter,S.Cannella,NO,PHI,7,0
3,46,1,2,2548,1,10,80,0,1,NO,PHI,J.Ellis rushed left guard to NO 26 for 6 yards. Tackled by C.Phillips at NO 26.,1.04598426260054,0.244665274396539,6,NA,J.Ellis,NA,NO,PHI,7,0
3,47,1,2,2522,2,4,74,0,1,NO,PHI,"J.Ellis rushed right end to NO 34 for 8 yards. Tackled by J.Moore, L.Wiley at NO 34.",1.29064953699708,0.659217893378809,8,NA,J.Ellis,NA,NO,PHI,7,0
3,48,1,2,2491,1,10,66,1,0,NO,PHI,"K.Sloter pass short left complete to NO 33. Catch made by T.Logan at NO 33. Gain of 3 yards. Pushed out of bounds by E.Worthington, M.Lewis at NO 37.",1.94986743037589,-0.247245119186118,3,-1,K.Sloter,T.Logan,NO,PHI,7,0
